,Company,Rating,Position,Experience,Salary,Location,Skills,Link
0,Accenture Solutions Pvt Ltd,4.0,Data Science Application Lead,Accenture Solutions Pvt Ltd,Not disclosed,Bangalore/Bengaluru,IT SkillsPythonData ScienceMachine LearningNoSQLcassandraConsultingMongoDB,https://www.naukri.com/job-listings-data-science-application-lead-accenture-solutions-pvt-ltd-bangalore-bengaluru-8-to-10-years-280621911944?src=jobsearchDesk&sid=16254084478143600&xp=1&px=2
1,UNITED TECHNOLOGIES CORPORATION INDIA PRIVATE LIMI ,Nan,Senior Specialist - Data Science & Analytics | Pratt & Whitney |,UNITED TECHNOLOGIES CORPORATION INDIA PRIVATE LIMI ,Not disclosed,Bangalore/Bengaluru,Data ScienceTensorflowHiveArtificial IntelligenceHadoopMachine LearningAnalyticsPython,https://www.naukri.com/job-listings-senior-specialist-data-science-analytics-pratt-whitney-united-technologies-corporation-india-private-limi-bangalore-bengaluru-5-to-10-years-140621002813?src=jobsearchDesk&sid=16254084478143600&xp=2&px=2
2,Reliance Jio Infocomm Ltd.,4.0,Manager Data Science,Reliance Jio Infocomm Ltd.,Not disclosed,Bangalore/Bengaluru,Report generationData managementMachine learningData structuresBusiness modelingMobile applicationsData warehousingPredictive analytics,https://www.naukri.com/job-listings-manager-data-science-reliance-jio-infocomm-ltd-bangalore-bengaluru-5-to-8-years-010721501332?src=jobsearchDesk&sid=16254084478143600&xp=3&px=2
3,Orcapod Consulting Services Private Limited  ,Nan,Design Engineer Specialist - Data Science,Orcapod Consulting Services Private Limited  ,"15,00,000 - 30,00,000 PA.",Bangalore/Bengaluru,sagemakeralgorithmspythonEDAnetwork inventoryRegressiontopic modelingpyspark,https://www.naukri.com/job-listings-design-engineer-specialist-data-science-orcapod-consulting-services-private-limited-bangalore-bengaluru-9-to-14-years-030721602937?src=jobsearchDesk&sid=16254084478143600&xp=4&px=2
4,Orcapod Consulting Services Private Limited  ,Nan,Design Engineer Specialist - Data Science,Orcapod Consulting Services Private Limited  ,"15,00,000 - 30,00,000 PA.",Bangalore/Bengaluru,sagemakeralgorithmspythonEDAnetwork inventoryRegressiontopic modelingpyspark,https://www.naukri.com/job-listings-design-engineer-specialist-data-science-orcapod-consulting-services-private-limited-bangalore-bengaluru-9-to-14-years-030721002935?src=jobsearchDesk&sid=16254084478143600&xp=5&px=2
5,Bigshyft Hiring for KeepTruckin,Nan,Manager Data Science,Bigshyft Hiring for KeepTruckin,"18,00,000 - 33,00,000 PA.",Bangalore/Bengaluru,AlgorithmsData AnalysisMachine Learning MLSQLPython,https://www.naukri.com/job-listings-manager-data-science-bigshyft-hiring-for-keeptruckin-bangalore-bengaluru-5-to-10-years-300621900705?src=jobsearchDesk&sid=16254084478143600&xp=6&px=2
6,Blue Ocean Catalyst Private Limited,Nan,Data Science,Blue Ocean Catalyst Private Limited,Not disclosed,"Kolkata, Bangalore/Bengaluru",Logistic regressionData analysisStatistical analysisdata scienceMachine learningBusiness intelligencebig dataAnalytics,https://www.naukri.com/job-listings-data-science-blue-ocean-catalyst-private-limited-kolkata-bangalore-bengaluru-2-to-5-years-220621501244?src=jobsearchDesk&sid=16254084478143600&xp=7&px=2
7,IBM India Pvt. Limited,4.0,Data Science Engineer,IBM India Pvt. Limited,Not disclosed,Bangalore/Bengaluru,IT SkillsJavaPythonSoftware DevelopmentTestingData ScienceMachine LearningComputer science,https://www.naukri.com/job-listings-data-science-engineer-ibm-india-pvt-limited-bangalore-bengaluru-6-to-10-years-240621906648?src=jobsearchDesk&sid=16254084478143600&xp=8&px=2
8,IBM India Pvt. Limited,4.0,Data Science Engineer,IBM India Pvt. Limited,Not disclosed,Bengaluru/Bangalore,KubernetesPythonagileExcelJavaWEKAMLlibVMware,https://www.naukri.com/job-listings-data-science-engineer-ibm-india-pvt-limited-bengaluru-bangalore-6-to-7-years-210621901999?src=jobsearchDesk&sid=16254084478143600&xp=9&px=2
9,Zycus Infotech Pvt Ltd,3.2,Director Data Science,Zycus Infotech Pvt Ltd,Not disclosed,Bangalore/Bengaluru,Predictive ModelingJavaC++data modellingArtificial IntelligencePerlMachine LearningAngular,https://www.naukri.com/job-listings-director-data-science-zycus-infotech-pvt-ltd-bangalore-bengaluru-14-to-17-years-290621902753?src=jobsearchDesk&sid=16254084478143600&xp=10&px=2
10,Accenture Solutions Pvt Ltd,4.0,Associate-Data Science,Accenture Solutions Pvt Ltd,Not disclosed,Bangalore/Bengaluru,IT SkillsData ScienceMachine LearningArtificial IntelligenceStatistical programmingComputer sciencePublishingArchitecture,https://www.naukri.com/job-listings-associate-data-science-accenture-solutions-pvt-ltd-bangalore-bengaluru-1-to-3-years-280621907378?src=jobsearchDesk&sid=16254084478143600&xp=11&px=2
11,Accenture Solutions Pvt Ltd,4.0,Associate-Data Science,Accenture Solutions Pvt Ltd,Not disclosed,Bangalore/Bengaluru,IT SkillsData ScienceArtificial IntelligenceAnalytical skillsPublishingArchitectureConsultingdata visualization,https://www.naukri.com/job-listings-associate-data-science-accenture-solutions-pvt-ltd-bangalore-bengaluru-1-to-3-years-280621908193?src=jobsearchDesk&sid=16254084478143600&xp=12&px=2
12,Accenture Solutions Pvt Ltd,4.0,Team Lead/Consultant-Data Science,Accenture Solutions Pvt Ltd,Not disclosed,Bangalore/Bengaluru,IT SkillsData ScienceArtificial IntelligenceAnalytical skillsStatistical analysisPublishingArchitecturemanagement,https://www.naukri.com/job-listings-team-lead-consultant-data-science-accenture-solutions-pvt-ltd-bangalore-bengaluru-7-to-11-years-280621908091?src=jobsearchDesk&sid=16254084478143600&xp=13&px=2
13,4ONLINEMEDIA ,Nan,Freshers- Data Science and Analytics,4ONLINEMEDIA ,"3,00,000 - 5,00,000 PA.",Bangalore/Bengaluru,analyticalData Analyticsmachine learningData scienceDeep learningTableauIT SkillsPython,https://www.naukri.com/job-listings-freshers-data-science-and-analytics-4onlinemedia-bangalore-bengaluru-0-to-5-years-030721000504?src=jobsearchDesk&sid=16254084478143600&xp=14&px=2
14,Accenture Solutions Pvt Ltd,4.0,Team Lead/Consultant-Data Science,Accenture Solutions Pvt Ltd,Not disclosed,Bangalore/Bengaluru,IT SkillsData ScienceMachine LearningArtificial IntelligenceBig DataTableauPublishingArchitecture,https://www.naukri.com/job-listings-team-lead-consultant-data-science-accenture-solutions-pvt-ltd-bangalore-bengaluru-7-to-11-years-010721901911?src=jobsearchDesk&sid=16254084478143600&xp=15&px=2
15,Ally -eXecutive HR Consulting Partner,Nan,Team Lead/Manager - Data Science - Spark/Python,Ally -eXecutive HR Consulting Partner,Not disclosed,Bangalore/Bengaluru,IT SkillsJavaPythonData ScienceMachine LearningCloudBig DataHive,https://www.naukri.com/job-listings-team-lead-manager-data-science-spark-python-ally-executive-hr-consulting-partner-bangalore-bengaluru-8-to-12-years-100321901883?src=jobsearchDesk&sid=16254084478143600&xp=16&px=2
16,CHANGE LEADERS CONSULTING,Nan,Tech PM Data Science | MNC | 5 Days Working,CHANGE LEADERS CONSULTING,"20,00,000 - 35,00,000 PA.",Bangalore/Bengaluru,Data ScienceRTechnical Project ManagerData ScientistArtificial IntelligenceAITechnical LeadershipStatistical Modelling,https://www.naukri.com/job-listings-tech-pm-data-science-mnc-5-days-working-change-leaders-consulting-bangalore-bengaluru-10-to-15-years-010721605030?src=jobsearchDesk&sid=16254084478143600&xp=17&px=2
17,Talpro,Nan,Chief Intelligence Officer - Data Science & Analytics,Talpro,Not disclosed,"Mumbai, Gurgaon/Gurugram, Delhi / NCR, Bangalore/Bengaluru",SASData ManagementStatisticsAnalytics,https://www.naukri.com/job-listings-chief-intelligence-officer-data-science-analytics-talpro-mumbai-gurgaon-gurugram-delhi-ncr-bangalore-bengaluru-8-to-12-years-110620904735?src=jobsearchDesk&sid=16254084478143600&xp=18&px=2
18,NELSON CONSULTANTS   ,Nan,"Data Science -Algorithm Expert (NLP ) Java, Python, C++ |8+Exp |Blore",NELSON CONSULTANTS   ,Not disclosed,Bangalore/Bengaluru,PythonJavaC ++syntax analysisalgorithmmachine learningopinion miningC++,https://www.naukri.com/job-listings-data-science-algorithm-expert-nlp-java-python-c-8-exp-blore-nelson-consultants-bangalore-bengaluru-6-to-10-years-300621002168?src=jobsearchDesk&sid=16254084478143600&xp=19&px=2
19,EDU ANGELS INDIA PVT LTD  ,Nan,Curriculum Assistant (Data Science),EDU ANGELS INDIA PVT LTD  ,"6,00,000 - 10,00,000 PA.","Bangalore/Bengaluru, Mumbai (All Areas)",Curriculum DevelopmentPython,https://www.naukri.com/job-listings-curriculum-assistant-data-science-edu-angels-india-pvt-ltd-bangalore-bengaluru-mumbai-all-areas-1-to-4-years-290621007670?src=jobsearchDesk&sid=16254084478143600&xp=20&px=2
20,Quality Engineering  Software Technologies Pvt. Ltd.,3.3,Data Science,Quality Engineering  Software Technologies Pvt. Ltd.,Not disclosed,Bangalore/Bengaluru,IT SkillsTestingData ScienceMachine LearningCloudAWSAzureApplication design,https://www.naukri.com/job-listings-data-science-quality-engineering-software-technologies-pvt-ltd-bangalore-bengaluru-6-to-9-years-250621501195?src=jobsearchDesk&sid=16254084772641621&xp=1&px=3
21,Accenture Solutions Pvt Ltd,4.0,Team Lead/Consultant-Data Science,Accenture Solutions Pvt Ltd,Not disclosed,Bangalore/Bengaluru,IT SkillsData ScienceMachine LearningArtificial IntelligencePublishingProcess orientationArchitectureConsulting,https://www.naukri.com/job-listings-team-lead-consultant-data-science-accenture-solutions-pvt-ltd-bangalore-bengaluru-7-to-11-years-230621906029?src=jobsearchDesk&sid=16254084772641621&xp=2&px=3
22,DXC Technology,3.5,Associate Professional Data Sciences,DXC Technology,Not disclosed,Bangalore/Bengaluru,HTML5SpotfireTableauPythonSPSSmachine learningRQlikview,https://www.naukri.com/job-listings-associate-professional-data-sciences-dxc-technology-bangalore-bengaluru-0-to-2-years-220421501142?src=jobsearchDesk&sid=16254084772641621&xp=3&px=3
23,Quality Engineering  Software Technologies Pvt. Ltd.,3.3,Data Science consultant,Quality Engineering  Software Technologies Pvt. Ltd.,Not disclosed,Bangalore/Bengaluru,big dataDockersnumpyDevOpsmathplotlibkerasspacyPython,https://www.naukri.com/job-listings-data-science-consultant-quality-engineering-software-technologies-pvt-ltd-bangalore-bengaluru-3-to-6-years-220621501131?src=jobsearchDesk&sid=16254084772641621&xp=4&px=3
24,NewsHunt,Nan,Data Science - Boot Camp,NewsHunt,Not disclosed,Bangalore/Bengaluru,data scienceMachine learningProgrammingInfrastructureDeploymentResearchDistribution systemMonitoring,https://www.naukri.com/job-listings-data-science-boot-camp-newshunt-bangalore-bengaluru-2-to-5-years-210621500699?src=jobsearchDesk&sid=16254084772641621&xp=5&px=3
25,Siemens Limited,4.2,Senior Data Science Engineer,Siemens Limited,Not disclosed,Bangalore/Bengaluru,Data analysisGITCodingSoftware configuration managementConsultingIntegration testingAgileUnit testing,https://www.naukri.com/job-listings-senior-data-science-engineer-siemens-limited-bangalore-bengaluru-0-to-5-years-100621500954?src=jobsearchDesk&sid=16254084772641621&xp=6&px=3
26,CHANGE LEADERS CONSULTING,Nan,Sr. Associate - Data Science,CHANGE LEADERS CONSULTING,Not disclosed,Bangalore/Bengaluru,Machine LearningPythonSQLPredictive ModelingPysparkRHiveHadoop,https://www.naukri.com/job-listings-sr-associate-data-science-change-leaders-consulting-bangalore-bengaluru-2-to-4-years-210621608209?src=jobsearchDesk&sid=16254084772641621&xp=7&px=3
27,RGF Professional Recruitment,2.8,Application Developer Sr. Data Science,RGF Professional Recruitment,Not disclosed,Bengaluru,Computer scienceMS SQLData analysisdata scienceData modelingWeb developmentWorkflowStored procedures,https://www.naukri.com/job-listings-application-developer-sr-data-science-rgf-professional-recruitment-bengaluru-bangalore-6-to-8-years-220321500830?src=jobsearchDesk&sid=16254084772641621&xp=8&px=3
28,NetApp,4.1,Senior Data Science Engineer,NetApp,Not disclosed,Bangalore/Bengaluru,Computer scienceData analysisdata scienceData managementAnalyticalMachine learningapplication architectureHigh level design,https://www.naukri.com/job-listings-senior-data-science-engineer-netapp-india-private-limited-bangalore-bengaluru-7-to-12-years-070521906950?src=jobsearchDesk&sid=16254084772641621&xp=9&px=3
29,Nuware  Systems Pvt Ltd,4.1,Analyst - Data Science,Nuware  Systems Pvt Ltd,Not disclosed,Bengaluru,Data analysisRDBMSBfsiApplication programmingMachine learningInvestment bankingData miningMacros,https://www.naukri.com/job-listings-analyst-data-science-nuware-systems-pvt-ltd-bengaluru-bangalore-3-to-6-years-301019501355?src=jobsearchDesk&sid=16254084772641621&xp=10&px=3
30,Epsilon,3.8,Data Science Analyst 2,Epsilon,Not disclosed,Bangalore/Bengaluru,IT SkillsTestingData ScienceData analysisFactor analysisAnalyticalMachine learningRisk management,https://www.naukri.com/job-listings-data-science-analyst-2-epsilon-bangalore-bengaluru-2-to-5-years-210421500356?src=jobsearchDesk&sid=16254084772641621&xp=11&px=3
31,Bloom Consulting Services,4.1,Analyst (Data Science),Bloom Consulting Services,Not disclosed,Bengaluru,githubVersion controldata scienceSQL databaseAgile developmentcontrol testingConsultingMachine learning,https://www.naukri.com/job-listings-analyst-data-science-bloom-consulting-services-bengaluru-bangalore-3-to-8-years-201218500271?src=jobsearchDesk&sid=16254084772641621&xp=12&px=3
32,CRED,Nan,data science analyst,CRED,Not disclosed,Bangalore/Bengaluru,Analytical skillsHealth insurancedata scienceData qualityData miningbig dataOperationsMonitoring,https://www.naukri.com/job-listings-data-science-analyst-cred-bangalore-bengaluru-1-to-3-years-170621502054?src=jobsearchDesk&sid=16254084772641621&xp=13&px=3
33,Catalyst,3.7,Data Science/analysis Expert - Machine Learning,Catalyst,Not disclosed,Bangalore/Bengaluru,IT SkillsPythonData ScienceMachine LearningTableauanalyticsdeep learningalgorithms,https://www.naukri.com/job-listings-data-science-analysis-expert-machine-learning-catalyst-bangalore-bengaluru-2-to-6-years-160919001838?src=jobsearchDesk&sid=16254084772641621&xp=14&px=3
34,Cigna TTK,4.0,Data Science Analyst,Cigna TTK,Not disclosed,Bangalore/Bengaluru,SASIVRAnalyticalHealthcarePredictive modelingAdobeEconometricsFinancial services,https://www.naukri.com/job-listings-data-science-analyst-cigna-ttk-health-insurance-company-limited-bangalore-bengaluru-3-to-5-years-110521500322?src=jobsearchDesk&sid=16254084772641621&xp=15&px=3
35,GAMA India,Nan,Data Science Engineer - BFSI,GAMA India,Not disclosed,Bangalore/Bengaluru,Data ScienceData ScientistBig DataMachine LearningStatisticsPython,https://www.naukri.com/job-listings-data-science-engineer-bfsi-gama-india-bangalore-bengaluru-3-to-7-years-240621906452?src=jobsearchDesk&sid=16254084772641621&xp=16&px=3
36,EMSOL Employment Solutions ,Nan,Manager Data Science,EMSOL Employment Solutions ,"9,00,000 - 14,00,000 PA.","Pune, Bangalore/Bengaluru, Delhi / NCR",Data ScienceRPower Biprescriptive modelsMachine LearningPredictive AnalyticsPython,https://www.naukri.com/job-listings-manager-data-science-emsol-employment-solutions-pune-bangalore-bengaluru-delhi-ncr-9-to-14-years-020721004708?src=jobsearchDesk&sid=16254084772641621&xp=17&px=3
37,FUTURES AND CAREERS,Nan,Deputy Manager - Data Science,FUTURES AND CAREERS,Not disclosed,Bangalore/Bengaluru,IT SkillsPythonData ScienceMachine LearningBigData technologiesR ProgrammingPandasNumPy,https://www.naukri.com/job-listings-deputy-manager-data-science-futures-and-careers-bangalore-bengaluru-8-to-12-years-240621600495?src=jobsearchDesk&sid=16254084772641621&xp=18&px=3
38,Catalyst,3.7,Data Science Product Manager- Artificial Intelligence/Machine Learning,Catalyst,Not disclosed,Bangalore/Bengaluru,TensorflowYOLOResnetKubernetesMachine LearningagileNoSQLR,https://www.naukri.com/job-listings-data-science-product-manager-artificial-intelligence-machine-learning-catalyst-bangalore-bengaluru-4-to-9-years-210621906123?src=jobsearchDesk&sid=16254084772641621&xp=19&px=3
39,Accenture Solutions Pvt Ltd,4.0,Senior Analyst-Data Science,Accenture Solutions Pvt Ltd,Not disclosed,Bangalore/Bengaluru,IT SkillsData ScienceMachine LearningArtificial IntelligenceBusiness administrationAnalystPublishingArchitecture,https://www.naukri.com/job-listings-senior-analyst-data-science-accenture-solutions-pvt-ltd-bangalore-bengaluru-5-to-8-years-080621901553?src=jobsearchDesk&sid=16254084772641621&xp=20&px=3
40,FUTURES AND CAREERS,Nan,Deputy Manager - Data Science,FUTURES AND CAREERS,Not disclosed,Bangalore/Bengaluru,IT SkillsPythonData ScienceMachine LearningBigData technologiesR ProgrammingPandasNumPy,https://www.naukri.com/job-listings-deputy-manager-data-science-futures-and-careers-bangalore-bengaluru-8-to-12-years-240621600495?src=jobsearchDesk&sid=16254085052034419&xp=1&px=4
41,Dreamz Consultants,Nan,Data Science - Manager,Dreamz Consultants,Not disclosed,"Noida, Bangalore/Bengaluru",IT SkillsPythonSoftware DevelopmentData ScienceMachine LearningAzureNLPPower BI,https://www.naukri.com/job-listings-data-science-manager-dreamz-consultants-noida-bangalore-bengaluru-10-to-15-years-220621600465?src=jobsearchDesk&sid=16254085052034419&xp=2&px=4
42,Catalyst,Nan,Data Science Product Manager- Artificial Intelligence/Machine Learning,Catalyst,Not disclosed,Bangalore/Bengaluru,TensorflowYOLOResnetKubernetesMachine LearningagileNoSQLR,https://www.naukri.com/job-listings-data-science-product-manager-artificial-intelligence-machine-learning-catalyst-bangalore-bengaluru-4-to-9-years-210621906123?src=jobsearchDesk&sid=16254085052034419&xp=3&px=4
43,Accenture Solutions Pvt Ltd,4.0,Senior Analyst-Data Science,Accenture Solutions Pvt Ltd,Not disclosed,Bangalore/Bengaluru,IT SkillsData ScienceMachine LearningArtificial IntelligenceBusiness administrationAnalystPublishingArchitecture,https://www.naukri.com/job-listings-senior-analyst-data-science-accenture-solutions-pvt-ltd-bangalore-bengaluru-5-to-8-years-080621901553?src=jobsearchDesk&sid=16254085052034419&xp=4&px=4
44,Accenture Solutions Pvt Ltd,4.0,Senior Analyst-Data Science,Accenture Solutions Pvt Ltd,Not disclosed,Bangalore/Bengaluru,IT SkillsData ScienceMachine LearningArtificial IntelligenceAnalystPublishingArchitectureConsulting,https://www.naukri.com/job-listings-senior-analyst-data-science-accenture-solutions-pvt-ltd-bangalore-bengaluru-5-to-8-years-080621901236?src=jobsearchDesk&sid=16254085052034419&xp=5&px=4
45,Virtusa Consulting Services Pvt Ltd,3.4,Data science Managers - Immediate Joiners,Virtusa Consulting Services Pvt Ltd,Not disclosed,"Hyderabad/Secunderabad, Pune, Chennai, Bangalore/Bengaluru",IT SkillsPythonTestingData ScienceMachine LearningTableauPower BIR,https://www.naukri.com/job-listings-data-science-managers-immediate-joiners-virtusa-consulting-services-pvt-ltd-hyderabad-secunderabad-pune-chennai-bangalore-bengaluru-10-to-20-years-120521005153?src=jobsearchDesk&sid=16254085052034419&xp=6&px=4
46,DataTrained,4.4,Data Science Intern,DataTrained,Not disclosed,"Noida, Bengaluru",Computer scienceSANFrenchdata scienceInternAnalyticalMachine learningPredictive modeling,https://www.naukri.com/job-listings-data-science-intern-datatrained-noida-bengaluru-bangalore-0-to-2-years-040620500786?src=jobsearchDesk&sid=16254085052034419&xp=7&px=4
47,Mindtree Limited,4.0,Senior Project Manager -- Data Science,Mindtree Limited,Not disclosed,Bangalore/Bengaluru,Business processRetailInterpersonal skillsdata scienceBusiness AnalystData modelingConsultingData analytics,https://www.naukri.com/job-listings-senior-project-manager-data-science-mindtree-limited-bangalore-bengaluru-7-to-10-years-140521500819?src=jobsearchDesk&sid=16254085052034419&xp=8&px=4
48,Mindtree Limited,4.0,Data Science -- Senior Project Manager,Mindtree Limited,Not disclosed,Bangalore/Bengaluru,requirements gatheringdata gathering analysismachine learninganalyticalData analysisProduct engineeringNetwork designPrototype,https://www.naukri.com/job-listings-data-science-senior-project-manager-mindtree-limited-bangalore-bengaluru-7-to-10-years-170521500550?src=jobsearchDesk&sid=16254085052034419&xp=9&px=4
49,MarketScope,Nan,Mentor - Data Analyst/Data Science,MarketScope,Not disclosed,"Kolkata, Mumbai, Visakhapatnam, Hyderabad/Secunderabad, Pune, Chennai, Ahmedabad, Bangalore/Bengaluru, Delhi / NCR",ScalaPentahoLinuxGGPlotBig DataNoSQLTableauSpark,https://www.naukri.com/job-listings-mentor-data-analyst-data-science-marketscope-kolkata-mumbai-visakhapatnam-vizag-hyderabad-secunderabad-pune-chennai-ahmedabad-bangalore-bengaluru-delhi-ncr-3-to-5-years-050521905479?src=jobsearchDesk&sid=16254085052034419&xp=10&px=4
50,Catalyst,Nan,Data Science/ Analysis Expert - Machine Learning,Catalyst,Not disclosed,Bangalore/Bengaluru,Regression AlgorithmsNLPData ScientistArtificial IntelligenceData ModelingData WarehousingData AnalyticsETL,https://www.naukri.com/job-listings-data-science-analysis-expert-machine-learning-catalyst-bangalore-bengaluru-2-to-6-years-280720902564?src=jobsearchDesk&sid=16254085052034419&xp=11&px=4
51,Data is Good,Nan,Data Science Content Developer,Data is Good,"1,75,000 - 2,50,000 PA.","Bangalore/Bengaluru, Delhi / NCR, Mumbai (All Areas)",Data SciencePython DashExcelContent DevelopmentR ProgrammingStatistics and ProbabilityR ShinyWeb Scraping,https://www.naukri.com/job-listings-data-science-content-developer-data-is-good-bangalore-bengaluru-delhi-ncr-mumbai-all-areas-0-to-1-years-160621002732?src=jobsearchDesk&sid=16254085052034419&xp=12&px=4
52,Amploy.io,Nan,Data Science Intern (remote),Amploy.io,"13,00,000 - 18,00,000 PA.","Bangalore/Bengaluru, Delhi / NCR, Mumbai (All Areas)",Data ScienceApplication ProgrammingSoftware DevelopmentAIITCareer DevelopmentMachine LearningStartup,https://www.naukri.com/job-listings-data-science-intern-remote-amploy-io-bangalore-bengaluru-delhi-ncr-mumbai-all-areas-0-to-5-years-070621001131?src=jobsearchDesk&sid=16254085052034419&xp=13&px=4
53,ALTAIR DEVELOPERS PRIVATE LIMITED,3.9,QA Data Science Intern,ALTAIR DEVELOPERS PRIVATE LIMITED,Not disclosed,Bangalore/Bengaluru,IT SkillsJavaPythonData ScienceOracleQAInternSimulation,https://www.naukri.com/job-listings-qa-data-science-intern-altair-developers-private-limited-bangalore-bengaluru-0-to-1-years-020321500786?src=jobsearchDesk&sid=16254085052034419&xp=14&px=4
54,Winwire Technologies India Pvt. Ltd.,3.9,Data Science Module/Technical Lead,Winwire Technologies India Pvt. Ltd.,Not disclosed,"Hyderabad/Secunderabad, Bangalore/Bengaluru",AzureRcommunicationPandaswrittenAWSMatplotlibNumPy,https://www.naukri.com/job-listings-data-science-module-technical-lead-winwire-technologies-india-pvt-ltd-hyderabad-secunderabad-bangalore-bengaluru-6-to-8-years-150621500096?src=jobsearchDesk&sid=16254085052034419&xp=15&px=4
55,KeepTruckin,Nan,Manager Data Science,KeepTruckin,Not disclosed,Bangalore/Bengaluru,Computer scienceStatistical programmingSANData analysisdata scienceMachine learningTelematicsFreight,https://www.naukri.com/job-listings-manager-data-science-keeptruckin-bangalore-bengaluru-4-to-7-years-090621500118?src=jobsearchDesk&sid=16254085052034419&xp=16&px=4
56,Mindtree Limited,4.0,Technical Lead -- Data Science,Mindtree Limited,Not disclosed,Bangalore/Bengaluru,data scienceSPARK ScalaMLPySparkAzure dataMachine learningAnalysisIT Skills,https://www.naukri.com/job-listings-technical-lead-data-science-mindtree-limited-bangalore-bengaluru-8-to-10-years-040521500207?src=jobsearchDesk&sid=16254085052034419&xp=17&px=4
57,GO-JEK India,4.4,Manager - Data Science,GO-JEK India,Not disclosed,Bengaluru,IT SkillsPythonMachine LearningProject ManagementBPOproject managementData analysisdata science,https://www.naukri.com/job-listings-manager-data-science-go-jek-india-bengaluru-bangalore-8-to-9-years-280121500419?src=jobsearchDesk&sid=16254085052034419&xp=18&px=4
58,BRIDGEi2i Analytics Solutions Private Limited,3.5,SCM - DATA SCIENCE,BRIDGEi2i Analytics Solutions Private Limited,Not disclosed,Bangalore/Bengaluru,ProcurementPMPData analysisSupply chain managementdata scienceSimulationSCMRisk management,https://www.naukri.com/job-listings-scm-data-science-bridgei2i-analytics-solutions-private-limited-bangalore-bengaluru-3-to-6-years-200521500792?src=jobsearchDesk&sid=16254085052034419&xp=19&px=4
59,Signify,4.1,Development Engineer - Data Science,Signify,Not disclosed,Bangalore/Bengaluru,data scienceArtificial IntelligenceDiversity and InclusionMachine learningAgileData collectionData analyticsData mining,https://www.naukri.com/job-listings-development-engineer-data-science-signify-bangalore-bengaluru-7-to-10-years-140521500017?src=jobsearchDesk&sid=16254085052034419&xp=20&px=4
60,Faster Consultancy Services,Nan,Manager - Data Science,Faster Consultancy Services,Not disclosed,Bengaluru,C++data scienceCodingMachine learningData structuresInformation retrievalNatural language processingSystem development,https://www.naukri.com/job-listings-manager-data-science-faster-consultancy-services-bengaluru-bangalore-0-to-5-years-231120500870?src=jobsearchDesk&sid=16254085391249422&xp=1&px=5
61,Perform Group,4.2,Principal Data Scientist/ Manager - Data Science,Perform Group,Not disclosed,Bangalore/Bengaluru,data scienceOpencvConsultingResearchAWSPrincipalPython,https://www.naukri.com/job-listings-principal-data-scientist-manager-data-science-perform-group-bangalore-bengaluru-8-to-12-years-200521500300?src=jobsearchDesk&sid=16254085391249422&xp=2&px=5
62,NeenOpal Intelligent Solutions Pvt. Ltd.,Nan,Data Science Internship - Immediate Joining,NeenOpal Intelligent Solutions Pvt. Ltd.,Not disclosed,Bangalore/Bengaluru,data scienceInternCodingMachine learningData analyticsInternshipPython,https://www.naukri.com/job-listings-data-science-internship-immediate-joining-neenopal-intelligent-solutions-pvt-ltd-bengaluru-bangalore-0-to-1-years-060820500715?src=jobsearchDesk&sid=16254085391249422&xp=3&px=5
