,Company,Rating,Position,Experience,Salary,Location,Skills,Link
63,Accenture Solutions Pvt Ltd,4.0,Dataiku Data Science Studio (DSS) Application Developer,Accenture Solutions Pvt Ltd,Not disclosed,Bangalore/Bengaluru,R STATISTICS PROGRAMMINGMachine LearningDataiku Data Science StudioPYTHONcommunicationanalyticalAWSSQL,https://www.naukri.com/job-listings-dataiku-data-science-studio-dss-application-developer-accenture-solutions-pvt-ltd-bangalore-bengaluru-4-to-6-years-170621907481?src=jobsearchDesk&sid=16254085391249422&xp=4&px=5
64,GENPACT India Private Limited,4.0,Machine Learning & Automation Expert - Data Science,GENPACT India Private Limited,Not disclosed,"Gurgaon/Gurugram, Bangalore/Bengaluru",Data ScienceMachine Learning,https://www.naukri.com/job-listings-machine-learning-automation-expert-data-science-genpact-india-private-limited-gurgaon-gurugram-bangalore-bengaluru-6-to-11-years-130521002558?src=jobsearchDesk&sid=16254085391249422&xp=5&px=5
65,Musubi Management Private Limited,Nan,Web Development/Data Science Trainee,Musubi Management Private Limited,"3,50,000 - 6,00,000 PA.",Bangalore/Bengaluru(5th block Koramangala),Data ScienceWeb DevelopmentIT SkillsPythonWeb Technologies,https://www.naukri.com/job-listings-web-development-data-science-trainee-musubi-management-private-limited-bangalore-bengaluru-0-to-0-years-110621002643?src=jobsearchDesk&sid=16254085391249422&xp=6&px=5
66,Talpro,Nan,Data Sciences Engineer - Big Data,Talpro,Not disclosed,"Bangalore/Bengaluru, Delhi / NCR",IT SkillsBig Data Data Sciences EngineerData Management,https://www.naukri.com/job-listings-data-sciences-engineer-big-data-talpro-bangalore-bengaluru-delhi-ncr-2-to-5-years-010721903713?src=jobsearchDesk&sid=16254085391249422&xp=7&px=5
67,Acuity Knowledge Partners,3.2,Data Science – ML Engineer,Acuity Knowledge Partners,Not disclosed,Bangalore/Bengaluru,TensorflowNatural Language ProcessingMachine LearningDeep LearningData SciencePytorchNLPNoSQL,https://www.naukri.com/job-listings-data-science-ml-engineer-acuity-knowledge-services-india-private-limited-bangalore-bengaluru-1-to-3-years-160621007819?src=jobsearchDesk&sid=16254085391249422&xp=8&px=5
68,Premier Consultants ,Nan,Analyst/Sr.Analyst-Data Science with AI/ML based Company,Premier Consultants ,"15,00,000 - 20,00,000 PA.","Pune, Bangalore/Bengaluru",Data ScienceNLPBFSIData ScientistCredit RiskMachine Learning ModelCredit BureauMachine Learning,https://www.naukri.com/job-listings-analyst-sr-analyst-data-science-with-ai-ml-based-company-premier-consultants-pune-bangalore-bengaluru-2-to-5-years-160621000652?src=jobsearchDesk&sid=16254085391249422&xp=9&px=5
69,NELSON CONSULTANTS   ,Nan,"Data Science Search Ads Architecture-JAVA ,C ++, Python |8+ Exp
",NELSON CONSULTANTS   ,Not disclosed,Bangalore/Bengaluru,ranking engine-analysisJavaC++anti-cheating architectureBidding StrategiesSearch Advertising AllianceCTR estimationArchitectural Design,https://www.naukri.com/job-listings-data-science-search-ads-architecture-java-c-python-8-exp-nelson-consultants-bangalore-bengaluru-8-to-10-years-300621003507?src=jobsearchDesk&sid=16254085391249422&xp=10&px=5
70,ZS Associates,3.8,Data Science Consultant,ZS Associates,Not disclosed,Bengaluru,IT SkillsJavaPythonTestingData ScienceMachine LearningProject Managementdata science OR data scientist OR machine learning OR NLP OR Natural language processing,https://www.naukri.com/job-listings-data-science-consultant-zs-associates-bengaluru-5-to-5-years-070621900917?src=jobsearchDesk&sid=16254085391249422&xp=11&px=5
71,ZS Associates,3.8,Data Science Associate Consultant,ZS Associates,Not disclosed,Bengaluru,IT SkillsJavaPythonTestingData ScienceMachine LearningProject Managementdata science OR data scientist OR machine learning OR NLP OR Natural language processing,https://www.naukri.com/job-listings-data-science-associate-consultant-zs-associates-bengaluru-3-to-3-years-070621900914?src=jobsearchDesk&sid=16254085391249422&xp=12&px=5
72,ZS Associates India Pvt Ltd,3.8,Data Science Manager,ZS Associates India Pvt Ltd,Not disclosed,"Pune, Bangalore/Bengaluru",PythonBig DataIT SkillsCloudProject ManagementBPOproject managementData Science,https://www.naukri.com/job-listings-data-science-manager-zs-associates-india-pvt-ltd-pune-bangalore-bengaluru-9-to-14-years-010621001414?src=jobsearchDesk&sid=16254085391249422&xp=13&px=5
73,OceanOfWeb,Nan,Python Tech Lead - RDBMS / Data Science,OceanOfWeb,Not disclosed,"Hyderabad/Secunderabad, Bangalore/Bengaluru",IT SkillsPythonData ScienceDevOpsJavascriptRDBMS Python Tech Leadweb applications ,https://www.naukri.com/job-listings-python-tech-lead-rdbms-data-science-oceanofweb-hyderabad-secunderabad-bangalore-bengaluru-7-to-12-years-110621908103?src=jobsearchDesk&sid=16254085391249422&xp=14&px=5
74,Hindustan Coca Cola Beverages Pvt Ltd,4.4,Manager - Strategic Analytics & Data Science,Hindustan Coca Cola Beverages Pvt Ltd,Not disclosed,Bangalore/Bengaluru,Data ScienceRCorrelationSegmentationStatistical ModelingAnovaStatisticsAnalytics,https://www.naukri.com/job-listings-manager-strategic-analytics-data-science-hindustan-coca-cola-beverages-pvt-ltd-bangalore-bengaluru-4-to-9-years-080621910782?src=jobsearchDesk&sid=16254085391249422&xp=15&px=5
75,YMetis India Pvt,Nan,Data Science Lead,YMetis India Pvt,Not disclosed,"Gurgaon/Gurugram, Bangalore/Bengaluru",Data ScienceBig DataData AnalyticsAnalyticsSQLPython,https://www.naukri.com/job-listings-data-science-lead-ymetis-india-pvt-gurgaon-gurugram-bangalore-bengaluru-6-to-11-years-030621905739?src=jobsearchDesk&sid=16254085391249422&xp=16&px=5
76,Datazymes,3.5,Data Analyst - Life science/Pharma (SAS/R/SQL/Tableau/BI),Datazymes,Not disclosed,Bangalore/Bengaluru,Computer sciencedata sciencePharmaConsultingSAS RLife sciencesInformation managementBusiness intelligence,https://www.naukri.com/job-listings-data-analyst-life-science-pharma-sas-r-sql-tableau-bi-datazymes-bangalore-bengaluru-3-to-6-years-020621500459?src=jobsearchDesk&sid=16254085391249422&xp=17&px=5
77,jupiter,Nan,"Senior Software Engineer , Data Science",jupiter,Not disclosed,Bangalore/Bengaluru,Computer sciencedata scienceAnalyticalSCALABankingCMSProgrammingHTML,https://www.naukri.com/job-listings-senior-software-engineer-data-science-jupiter-bangalore-bengaluru-3-to-7-years-160421500169?src=jobsearchDesk&sid=16254085391249422&xp=18&px=5
78,Unravel,Nan,Sr . Software Engineer ( Data Science ),Unravel,Not disclosed,Bangalore/Bengaluru,DataBricksBig DataSparkKafkaImpalaPythonData ScienceHadoop,https://www.naukri.com/job-listings-sr-software-engineer-data-science-unravel-bangalore-bengaluru-3-to-6-years-190421501032?src=jobsearchDesk&sid=16254085391249422&xp=19&px=5
79,Accenture Solutions Pvt Ltd,4.0,Data Science Advanced Application Engineer,Accenture Solutions Pvt Ltd,Not disclosed,Bangalore/Bengaluru,Computer scienceAnalyticalConsultingMachine learningAgileData processingApplication developmentCalculus,https://www.naukri.com/job-listings-data-science-advanced-application-engineer-accenture-solutions-pvt-ltd-bangalore-bengaluru-6-to-8-years-150621910105?src=jobsearchDesk&sid=16254085391249422&xp=20&px=5
80,Accenture Solutions Pvt Ltd,4.0,Data Science Advanced Application Engineer,Accenture Solutions Pvt Ltd,Not disclosed,Bangalore/Bengaluru,communicationData ScienceDeep LearningData VisualizationAlgorithmsAdvanced Machine LearningMachine LearningData Wrangling,https://www.naukri.com/job-listings-data-science-advanced-application-engineer-accenture-solutions-pvt-ltd-bangalore-bengaluru-8-to-10-years-150621910718?src=jobsearchDesk&sid=16254085727298064&xp=1&px=6
81,Radial HR Solutions  ,Nan,Sr.Data Science,Radial HR Solutions  ,"6,00,000 - 16,00,000 PA.","United States (USA), Bangalore/Bengaluru",FlaskPythonAWS CloudIT SkillsData ScienceCloudAWSML Model,https://www.naukri.com/job-listings-sr-data-science-radial-hr-solutions-bangalore-bengaluru-united-states-usa-5-to-8-years-230621000659?src=jobsearchDesk&sid=16254085727298064&xp=2&px=6
82,Near Pte. Ltd.,Nan,"Senior, Data Science",Near Pte. Ltd.,Not disclosed,Bengaluru,Computer scienceTelecomCodingProject managementAnalyticalIntellectual propertyMachine learningANSI,https://www.naukri.com/job-listings-senior-data-science-near-pte-ltd-bengaluru-bangalore-4-to-8-years-250221501047?src=jobsearchDesk&sid=16254085727298064&xp=3&px=6
83,ExecBoardinAsia,Nan,Senior Manager I - Data Science (Marketplace),ExecBoardinAsia,Not disclosed,Bangalore/Bengaluru,data scienceAnalyticalMachine learningE-commerceManagementBusiness solutionsCostSupervision,https://www.naukri.com/job-listings-senior-manager-i-data-science-marketplace-execboardinasia-bangalore-bengaluru-11-to-15-years-280521501027?src=jobsearchDesk&sid=16254085727298064&xp=4&px=6
84,ExecBoardinAsia,Nan,"Senior Manager, Data Science",ExecBoardinAsia,Not disclosed,Bengaluru,Operations researchBusiness consultingPrimary researchdata scienceAnalyticalDemand forecastingMachine learningProduct design,https://www.naukri.com/job-listings-senior-manager-data-science-execboardinasia-bengaluru-bangalore-5-to-10-years-220820500145?src=jobsearchDesk&sid=16254085727298064&xp=5&px=6
85,Walmart Labs,4.2,Senior Manager I - Data Science (Marketplace),Walmart Labs,Not disclosed,Bangalore/Bengaluru,data scienceCodingGCPAnalyticalMachine learningAgileData miningBusiness solutions,https://www.naukri.com/job-listings-senior-manager-i-data-science-marketplace-walmart-labs-bangalore-bengaluru-10-to-12-years-150421502035?src=jobsearchDesk&sid=16254085727298064&xp=6&px=6
86,Quantzig,Nan,Analytics Consultant - Senior Analytics Consultant – Data Science,Quantzig,Not disclosed,Bangalore/Bengaluru,Supply chaincustomer analyticsAnalyticalMarket intelligenceConsultingMachine learningForecastingAnalytics,https://www.naukri.com/job-listings-analytics-consultant-senior-analytics-consultant-data-science-quantzig-bangalore-bengaluru-2-to-4-years-220521500288?src=jobsearchDesk&sid=16254085727298064&xp=7&px=6
87,Near Pte. Ltd.,Nan,"Senior, Data Science ",Near Pte. Ltd.,Not disclosed,Bengaluru,Computer scienceTelecomCodingProject managementAnalyticalIntellectual propertyHTMLANSI,https://www.naukri.com/job-listings-senior-data-science-near-pte-ltd-bengaluru-bangalore-4-to-8-years-190221500738?src=jobsearchDesk&sid=16254085727298064&xp=8&px=6
88,RGF Professional Recruitment,2.8,Application & Automation Manager Data Science,RGF Professional Recruitment,Not disclosed,Bangalore/Bengaluru,AutomationjQuerydata scienceData modelingEnterprise applicationsAgileWorkflowSDLC,https://www.naukri.com/job-listings-application-automation-manager-data-science-rgf-professional-recruitment-bangalore-bengaluru-5-to-10-years-070621501124?src=jobsearchDesk&sid=16254085727298064&xp=9&px=6
89,ExecBoardinAsia,Nan,Director/Senior Manager - Data Science,ExecBoardinAsia,Not disclosed,Bangalore/Bengaluru,deep learningTeam managementdata scienceStaffingMachine learningCorporateStrategic planningBusiness strategy,https://www.naukri.com/job-listings-director-senior-manager-data-science-execboardinasia-bangalore-bengaluru-15-to-20-years-030521500206?src=jobsearchDesk&sid=16254085727298064&xp=10&px=6
90,Accenture Solutions Pvt Ltd,4.0,Data Science Application Lead,Accenture Solutions Pvt Ltd,Not disclosed,Bangalore/Bengaluru,Azure MLTensorflowPlotlySeabornClouderaAnalyticalcommunicationKeras,https://www.naukri.com/job-listings-data-science-application-lead-accenture-solutions-pvt-ltd-bangalore-bengaluru-6-to-8-years-020621905735?src=jobsearchDesk&sid=16254085727298064&xp=11&px=6
91,Reliance Jio Infocomm Ltd.,4.0,Manager Data Science,Reliance Jio Infocomm Ltd.,Not disclosed,Bangalore/Bengaluru,Report generationData managementMachine learningData structuresBusiness modelingMobile applicationsData warehousingPredictive analytics,https://www.naukri.com/job-listings-manager-data-science-reliance-jio-infocomm-ltd-bangalore-bengaluru-5-to-6-years-150621501164?src=jobsearchDesk&sid=16254085727298064&xp=12&px=6
92,Teamware Solutions,4.1,Data Science Requirements,Teamware Solutions,Not disclosed,Bangalore/Bengaluru,IT SkillsPythonMachine LearningBig DataComputer scienceText miningPDFWeb analytics,https://www.naukri.com/job-listings-data-science-requirements-teamware-solutions-bangalore-bengaluru-4-to-9-years-020320500210?src=jobsearchDesk&sid=16254085727298064&xp=13&px=6
93,Onsurity Technologies ,5.0,Data Analyst and Data Science,Onsurity Technologies ,"8,00,000 - 12,00,000 PA.",Bangalore/Bengaluru,AlteryxPower BiData AnalyticsPython,https://www.naukri.com/job-listings-data-analyst-and-data-science-onsurity-technologies-bangalore-bengaluru-4-to-6-years-240521001418?src=jobsearchDesk&sid=16254085727298064&xp=14&px=6
94,Onsurity Technologies ,5.0,Data Analyst and Data Science,Onsurity Technologies ,"8,00,000 - 12,00,000 PA.",Bangalore/Bengaluru,AlteryxPower BiData AnalyticsPython,https://www.naukri.com/job-listings-data-analyst-and-data-science-onsurity-technologies-bangalore-bengaluru-3-to-6-years-010621002781?src=jobsearchDesk&sid=16254085727298064&xp=15&px=6
95,Global Talent Pool,Nan,Data Science (ETO - Engineering),Global Talent Pool,Not disclosed,"Mumbai, Bengaluru",Computer sciencedata scienceAnalyticalProgrammingData structuresMathematicsStatisticsPython,https://www.naukri.com/job-listings-data-science-eto-engineering-global-talent-pool-mumbai-bengaluru-bangalore-3-to-5-years-191119500168?src=jobsearchDesk&sid=16254085727298064&xp=16&px=6
96,INTELLIPREDIKT TECHNOLOGIES PRIVATE LIMITED,4.6,Data Science Engineer,INTELLIPREDIKT TECHNOLOGIES PRIVATE LIMITED,Not disclosed,Bangalore/Bengaluru,Printingdata scienceMachine learningData analyticsdata visualization,https://www.naukri.com/job-listings-data-science-engineer-intellipredikt-technologies-private-limited-bangalore-bengaluru-1-to-5-years-040220500142?src=jobsearchDesk&sid=16254085727298064&xp=17&px=6
97,jupiter,Nan,Software Development Engineer - Platform Data Science,jupiter,Not disclosed,Bangalore/Bengaluru,Computer scienceObject oriented designdata scienceMachine learningIntegration testingCMSData structuresHTML,https://www.naukri.com/job-listings-software-development-engineer-platform-data-science-jupiter-bangalore-bengaluru-2-to-5-years-180221501588?src=jobsearchDesk&sid=16254085727298064&xp=18&px=6
98,Perform Group,4.2,Data Science Quality Assessment Engineer,Perform Group,Not disclosed,Bangalore/Bengaluru,Computer visionConstructionWeb technologiesdata scienceMachine learningManager TechnologyWellnessData analytics,https://www.naukri.com/job-listings-data-science-quality-assessment-engineer-perform-group-bengaluru-bangalore-3-to-6-years-120121501946?src=jobsearchDesk&sid=16254085727298064&xp=19&px=6
99,ExecBoardinAsia,Nan,Director Data Science,ExecBoardinAsia,Not disclosed,Bangalore/Bengaluru,advanced analyticsAutomationPrototypedata scienceAnalyticalDeploymentData qualityData analytics,https://www.naukri.com/job-listings-director-data-science-execboardinasia-bangalore-bengaluru-11-to-15-years-230920500099?src=jobsearchDesk&sid=16254085727298064&xp=20&px=6
100,ExecBoardinAsia,Nan,Associate Director - Data Science,ExecBoardinAsia,Not disclosed,Bangalore/Bengaluru,advanced analyticsData managementdata sciencebig data analyticsMachine learningCompetency developmentHR policiesE-commerce,https://www.naukri.com/job-listings-associate-director-data-science-execboardinasia-bangalore-bengaluru-11-to-15-years-121020500825?src=jobsearchDesk&sid=16254086058938210&xp=1&px=7
101,CDM SMITH GLOBAL SERVICES INDIA LLP,4.4,Intermediate Data Science Specialist,CDM SMITH GLOBAL SERVICES INDIA LLP,Not disclosed,Bangalore/Bengaluru,Data ScienceArtificial IntelligenceSQL QueriesMachine LearningDeep LearningPython,https://www.naukri.com/job-listings-intermediate-data-science-specialist-cdm-smith-global-services-india-llp-bangalore-bengaluru-3-to-6-years-010621006137?src=jobsearchDesk&sid=16254086058938210&xp=2&px=7
102,Suyati Technologies Pvt Ltd,4.4,Data Science Practice Manager,Suyati Technologies Pvt Ltd,Not disclosed,"Kochi/Cochin, Bangalore/Bengaluru",IT SkillsData ScienceMachine LearningBig DataTechnical managementbig data analyticsManager TechnologyPHP,https://www.naukri.com/job-listings-data-science-practice-manager-suyati-technologies-pvt-ltd-kochi-cochin-bangalore-bengaluru-12-to-17-years-260221500395?src=jobsearchDesk&sid=16254086058938210&xp=3&px=7
103,Enrich and Enlight,Nan,Associate Manager Data science,Enrich and Enlight,"15,00,000 - 30,00,000 PA.","Noida, Gurgaon/Gurugram, Bangalore/Bengaluru",verbal communicationSQLAzurePythonsoftware development life cycleSDLCPresentationwritten,https://www.naukri.com/job-listings-associate-manager-data-science-enrich-and-enlight-noida-gurgaon-gurugram-bangalore-bengaluru-5-to-10-years-240521001824?src=jobsearchDesk&sid=16254086058938210&xp=4&px=7
104,Gladwin Analytics,4.0,Country Manager - Data Science,Gladwin Analytics,Not disclosed,"Mumbai, Bengaluru",Product launchComputer scienceSAPdata scienceDiagnosticsCodingAnalyticalMachine learning,https://www.naukri.com/job-listings-country-manager-data-science-gladwin-analytics-mumbai-bengaluru-bangalore-8-to-13-years-221118500074?src=jobsearchDesk&sid=16254086058938210&xp=5&px=7
105,Perform Group,4.2,Data Science Specialist,Perform Group,Not disclosed,Bangalore/Bengaluru,data scienceOpencvConsultingResearchAWSPython,https://www.naukri.com/job-listings-data-science-specialist-perform-group-bangalore-bengaluru-3-to-5-years-200521501530?src=jobsearchDesk&sid=16254086058938210&xp=6&px=7
106,ExecBoardinAsia,Nan,"Asst. Manager, Data Science and Modelling",ExecBoardinAsia,Not disclosed,Bangalore/Bengaluru,data scienceProduct innovationBankingData qualityResearchdigital transformationAnalytics,https://www.naukri.com/job-listings-asst-manager-data-science-and-modelling-execboardinasia-bangalore-bengaluru-11-to-15-years-200421500431?src=jobsearchDesk&sid=16254086058938210&xp=7&px=7
107,Data is Good,Nan,Data Science Coach/Mentor/Instructor,Data is Good,Not disclosed,"Bangalore/Bengaluru, Delhi / NCR, Mumbai (All Areas)",Data ScienceBusiness IntelligenceNatural Language ProcessingTableauSparkData AnalyticsMachine LearningAWS,https://www.naukri.com/job-listings-data-science-coach-mentor-instructor-data-is-good-bangalore-bengaluru-delhi-ncr-mumbai-all-areas-3-to-8-years-160621002677?src=jobsearchDesk&sid=16254086058938210&xp=8&px=7
108,Mindtree Limited,4.0,Data Science -- Module Lead,Mindtree Limited,Not disclosed,Bangalore/Bengaluru,Search Engine OptimizationCommunicationCDesign PatternComputer scienceProduct managementdata scienceAnalytical,https://www.naukri.com/job-listings-data-science-module-lead-mindtree-limited-bangalore-bengaluru-3-to-6-years-140521500081?src=jobsearchDesk&sid=16254086058938210&xp=9&px=7
109,Joveo,Nan,Product Manager - Data Science ,Joveo,Not disclosed,"Hyderabad/Secunderabad, Bangalore/Bengaluru",Health insurancedata scienceMachine learningproduct life cycleProduct HeadAnalyticsProduct strategyRecruitment,https://www.naukri.com/job-listings-product-manager-data-science-joveo-hyderabad-secunderabad-bangalore-bengaluru-10-to-15-years-070521500966?src=jobsearchDesk&sid=16254086058938210&xp=10&px=7
110,Synergistic Compusoft Private Limited,Nan,Data science/Machine Learning trainer_Part time_Anywhere in india,Synergistic Compusoft Private Limited,Not disclosed,"Bangalore/Bengaluru, Delhi / NCR, Mumbai (All Areas)",Data ScienceMachine LearningPythonJavacommunicationTableauRData analysis,https://www.naukri.com/job-listings-data-science-machine-learning-trainer-part-time-anywhere-in-india-synergistic-compusoft-private-limited-bangalore-bengaluru-delhi-ncr-mumbai-all-areas-5-to-9-years-060521004539?src=jobsearchDesk&sid=16254086058938210&xp=11&px=7
111,ExecBoardinAsia,Nan,Assistant Director - Data Science,ExecBoardinAsia,Not disclosed,Bengaluru,Assistant Directordata scienceAnalyticalMachine learningResearchFactSupervision,https://www.naukri.com/job-listings-assistant-director-data-science-execboardinasia-bengaluru-bangalore-9-to-10-years-051120500928?src=jobsearchDesk&sid=16254086058938210&xp=12&px=7
112,Brigosha Technologies,3.5,Data Science & Cloud Analytics,Brigosha Technologies,Not disclosed,Bengaluru,Text miningGITNeural networksBusiness analyticsNetwork analysisMachine learningNatural language processingData mining,https://www.naukri.com/job-listings-data-science-cloud-analytics-brigosha-technologies-bengaluru-bangalore-3-to-6-years-281120500226?src=jobsearchDesk&sid=16254086058938210&xp=13&px=7
113,Gladwin Analytics,4.0,Assistant Manager - Data Science,Gladwin Analytics,Not disclosed,"Mumbai, Bengaluru",Logistic regressionStatistical analysisdata scienceSASAnalyticalMachine learningFMCGBusiness intelligence,https://www.naukri.com/job-listings-assistant-manager-data-science-gladwin-analytics-mumbai-bengaluru-bangalore-4-to-9-years-221118500069?src=jobsearchDesk&sid=16254086058938210&xp=14&px=7
114,ExecBoardinAsia,Nan,Data Science DVP VP Temp Role,ExecBoardinAsia,Not disclosed,Bangalore/Bengaluru,Logistic regressiondata scienceTime series analysisMachine learninglinear regressionRegression testingPattern recognitionData mining,https://www.naukri.com/job-listings-data-science-dvp-vp-temp-role-execboardinasia-bangalore-bengaluru-11-to-15-years-220421500292?src=jobsearchDesk&sid=16254086058938210&xp=15&px=7
115,BRIDGEi2i Analytics Solutions Private Limited,3.5,ANALYTICS CONSULTANT - DATA SCIENCE,BRIDGEi2i Analytics Solutions Private Limited,Not disclosed,Bangalore/Bengaluru,Statistical analysisdata scienceBusiness AnalystGCPMachine learningcloud storageAnalyticsSQL,https://www.naukri.com/job-listings-analytics-consultant-data-science-bridgei2i-analytics-solutions-private-limited-bangalore-bengaluru-3-to-5-years-210521500549?src=jobsearchDesk&sid=16254086058938210&xp=16&px=7
116,BRIDGEi2i Analytics Solutions Private Limited,3.5,SCM - DATA SCIENCE,BRIDGEi2i Analytics Solutions Private Limited,Not disclosed,Bangalore/Bengaluru,ProcurementSupply chain managementdata scienceSimulationAnalyticalMachine learningNetwork planningSCM,https://www.naukri.com/job-listings-scm-data-science-bridgei2i-analytics-solutions-private-limited-bangalore-bengaluru-2-to-4-years-200521500791?src=jobsearchDesk&sid=16254086058938210&xp=17&px=7
117,Burgeon IT Services Pvt ltd,4.1,Data Science Consultant,Burgeon IT Services Pvt ltd,Not disclosed,Bengaluru,Machine LearningAzure Cognitive ServicesPower AutomatePythonData ScienceIT SkillsAzureIT services,https://www.naukri.com/job-listings-data-science-consultant-burgeon-it-services-pvt-ltd-bengaluru-bangalore-5-to-8-years-180221500999?src=jobsearchDesk&sid=16254086058938210&xp=18&px=7
118,Optidesk Solutions Private Limited,Nan,MSSQL Data Science & R Analytics Programmer,Optidesk Solutions Private Limited,Not disclosed,Bengaluru,SAPSSRSMachine learningJSONWindowsStored proceduresOracleSSIS,https://www.naukri.com/job-listings-mssql-data-science-r-analytics-programmer-optidesk-solutions-private-limited-bengaluru-bangalore-2-to-6-years-171219500709?src=jobsearchDesk&sid=16254086058938210&xp=19&px=7
119,Accenture Solutions Pvt Ltd,4.0,Team Lead/Consultant-Data Science,Accenture Solutions Pvt Ltd,Not disclosed,Bangalore/Bengaluru,Publishingdata scienceArchitecturemanagementBusiness EconomicsMachine learningConsultingManagement,https://www.naukri.com/job-listings-team-lead-consultant-data-science-accenture-solutions-pvt-ltd-bangalore-bengaluru-7-to-11-years-170621907638?src=jobsearchDesk&sid=16254086058938210&xp=20&px=7
120,Brigosha Technologies,3.5,Data Science & Cloud Analytics,Brigosha Technologies,Not disclosed,Bengaluru,Text miningGITNeural networksBusiness analyticsNetwork analysisMachine learningNatural language processingData mining,https://www.naukri.com/job-listings-data-science-cloud-analytics-brigosha-technologies-bengaluru-bangalore-3-to-6-years-281120500226?src=jobsearchDesk&sid=16254086336976355&xp=1&px=8
121,AdmyBrand,Nan,Data Science,AdmyBrand,Not disclosed,Bangalore/Bengaluru,Printingdata scienceMachine learningData collectionRadioData miningAdvertisingAnalytics,https://www.naukri.com/job-listings-data-science-admybrand-bangalore-bengaluru-1-to-5-years-250319502477?src=jobsearchDesk&sid=16254086336976355&xp=2&px=8
122,Gladwin Analytics,4.0,Assistant Manager - Data Science,Gladwin Analytics,Not disclosed,"Mumbai, Bengaluru",Logistic regressionStatistical analysisdata scienceSASAnalyticalMachine learningFMCGBusiness intelligence,https://www.naukri.com/job-listings-assistant-manager-data-science-gladwin-analytics-mumbai-bengaluru-bangalore-4-to-9-years-221118500069?src=jobsearchDesk&sid=16254086336976355&xp=3&px=8
123,ExecBoardinAsia,Nan,Data Science DVP VP Temp Role,ExecBoardinAsia,Not disclosed,Bangalore/Bengaluru,Logistic regressiondata scienceTime series analysisMachine learninglinear regressionRegression testingPattern recognitionData mining,https://www.naukri.com/job-listings-data-science-dvp-vp-temp-role-execboardinasia-bangalore-bengaluru-11-to-15-years-220421500292?src=jobsearchDesk&sid=16254086336976355&xp=4&px=8
124,BRIDGEi2i Analytics Solutions Private Limited,3.5,ANALYTICS CONSULTANT - DATA SCIENCE,BRIDGEi2i Analytics Solutions Private Limited,Not disclosed,Bangalore/Bengaluru,Statistical analysisdata scienceBusiness AnalystGCPMachine learningcloud storageAnalyticsSQL,https://www.naukri.com/job-listings-analytics-consultant-data-science-bridgei2i-analytics-solutions-private-limited-bangalore-bengaluru-3-to-5-years-210521500549?src=jobsearchDesk&sid=16254086336976355&xp=5&px=8
125,BRIDGEi2i Analytics Solutions Private Limited,3.5,SCM - DATA SCIENCE,BRIDGEi2i Analytics Solutions Private Limited,Not disclosed,Bangalore/Bengaluru,ProcurementSupply chain managementdata scienceSimulationAnalyticalMachine learningNetwork planningSCM,https://www.naukri.com/job-listings-scm-data-science-bridgei2i-analytics-solutions-private-limited-bangalore-bengaluru-2-to-4-years-200521500791?src=jobsearchDesk&sid=16254086336976355&xp=6&px=8
